### ISSUE TITLE
[BUG] Network unreachable after some time

### ISSUE THREAD

**Issue by seagate00** [waydroid/waydroid#2318]
### Describe the bug

After some time (up to 3 hours), the network in the container (LXC) drops. I noticed that only IPv4 is available; **IPv6 continues to work fine**.

The Waydroid container is configured to access the local network (i.e., a network bridge is configured). But I should point out that even using the standard network configuration (interface via waydroid0), a similar issue occurs.

I tried reinstalling the OS on Debian 13, and the same issue occurs on that OS.

I also looked at the network traffic on the Waydroid container using tcpdump. It shows that all traffic (such as an ARP request) is being received by the container, but the container isn't responding.

The iptables/nfttables firewalls are completely disabled.

I also looked on another forum; someone had a similar issue. He managed to resolve it by manipulating the Android network daemon, netd, but he didn't provide a solution.

### Waydroid version

1.6.2

### Device

Linux Desktop

### Operating System

Ubuntu 26.04 amd64

### Kernel version

Linux ubuntu 7.0.0-15-generic #15-Ubuntu SMP PREEMPT_DYNAMIC Wed Apr 22 16:06:43 UTC 2026 x86_64 GNU/Linux

### Desktop Environment

GNOME 50

### GPU

Intel Corporation RocketLake-S GT1 [UHD Graphics 750] (rev 04) (Intel HD Graphics)

### Logs

[waydroid_logs.zip](https://github.com/user-attachments/files/27852615/waydroid_logs.zip)

IPv4:
```
130|:/ # ping 8.8.8.8
connect: Network is unreachable
```
IPv6:
```
:/ # ping6 -nc 4 ipv6.google.com                                                                                                                                                               
PING ipv6.google.com(2a00:1450:4010:c0f::64) 56 data bytes
64 bytes from 2a00:1450:4010:c0f::64: icmp_seq=1 ttl=109 time=47.1 ms
64 bytes from 2a00:1450:4010:c0f::64: icmp_seq=2 ttl=109 time=47.2 ms
64 bytes from 2a00:1450:4010:c0f::64: icmp_seq=3 ttl=109 time=47.1 ms
64 bytes from 2a00:1450:4010:c0f::64: icmp_seq=4 ttl=109 time=47.0 ms

--- ipv6.google.com ping statistics ---
4 packets transmitted, 4 received, 0% packet loss, time 3002ms
rtt min/avg/max/mdev = 47.093/47.139/47.206/0.269 ms
```

Host network configuration:
```
initrc@ubuntu:~$ ip a
1: lo: <LOOPBACK,UP,LOWER_UP> mtu 65536 qdisc noqueue state UNKNOWN group default qlen 1000
    link/loopback 00:00:00:00:00:00 brd 00:00:00:00:00:00
    inet 127.0.0.1/8 scope host lo
       valid_lft forever preferred_lft forever
    inet6 ::1/128 scope host noprefixroute 
       valid_lft forever preferred_lft forever
2: enp2s0: <BROADCAST,MULTICAST,UP,LOWER_UP> mtu 1500 qdisc mq master br0 state UP group default qlen 1000
    link/ether 18:c0:4d:e0:99:a7 brd ff:ff:ff:ff:ff:ff
    altname enx18c04de099a7
3: br0: <BROADCAST,MULTICAST,UP,LOWER_UP> mtu 1500 qdisc noqueue state UP group default qlen 1000
    link/ether ce:bb:94:95:3e:a1 brd ff:ff:ff:ff:ff:ff
    inet 10.0.0.176/24 brd 10.0.0.255 scope global dynamic noprefixroute br0
       valid_lft 1294sec preferred_lft 1294sec
    inet6 2a04:3800:0:2097:ccbb:94ff:fe95:3ea1/64 scope global dynamic noprefixroute 
       valid_lft 2591795sec preferred_lft 604595sec
    inet6 fe80::ccbb:94ff:fe95:3ea1/64 scope link noprefixroute 
       valid_lft forever preferred_lft forever
4: vethvwFQM5@if2: <BROADCAST,MULTICAST,UP,LOWER_UP> mtu 1500 qdisc noqueue master br0 state UP group default qlen 1000
    link/ether fe:a0:57:67:a6:b4 brd ff:ff:ff:ff:ff:ff link-netnsid 0
```

Android network configuration:
```
1: lo: <LOOPBACK,UP,LOWER_UP> mtu 65536 qdisc noqueue state UNKNOWN group default qlen 1000
    link/loopback 00:00:00:00:00:00 brd 00:00:00:00:00:00
    inet 127.0.0.1/8 scope host lo
       valid_lft forever preferred_lft forever
    inet6 ::1/128 scope host 
       valid_lft forever preferred_lft forever
2: eth0@if4: <BROADCAST,MULTICAST,UP,LOWER_UP> mtu 1500 qdisc noqueue state UP group default qlen 1000
    link/ether 00:16:3e:f9:d3:03 brd ff:ff:ff:ff:ff:ff link-netnsid 0
    inet 10.0.0.178/24 brd 10.0.0.255 scope global eth0
       valid_lft forever preferred_lft forever
    inet6 2a04:3800:0:2097:3ace:ca53:4262:1a3f/64 scope global dynamic mngtmpaddr stable-privacy 
       valid_lft 2591744sec preferred_lft 604544sec
    inet6 2a04:3800:0:2097:1424:d2bd:4d3a:9e4f/64 scope global temporary dynamic 
       valid_lft 158829sec preferred_lft 71876sec
    inet6 fe80::e6c2:8b1e:b640:df07/64 scope link stable-privacy 
       valid_lft forever preferred_lft forever
```

Android IPv4 route:
```
:/ # ip route                                                                                                                                                                                  
10.0.0.0/24 dev eth0 proto kernel scope link src 10.0.0.178
```

Android IPv6 route:
```
130|:/ # ip -6 route                                                                                                                                                                           
2a04:3800:0:2097::/64 dev eth0 proto kernel metric 256 expires 2591993sec pref medium
fe80::/64 dev eth0 proto kernel metric 256 pref medium
default via fe80::d601:c3ff:fec8:777c dev eth0 proto ra metric 1024 expires 1793sec hoplimit 64 pref low
```

Android tcpdump (note: 10.0.0.178 is address of Android container), arp should answer ARP **is it**:
```
:/ # tcpdump -ni any arp                                                                                                                                                                       
tcpdump: data link type LINUX_SLL2
tcpdump: verbose output suppressed, use -v[v]... for full protocol decode
listening on any, link-type LINUX_SLL2 (Linux cooked v2), snapshot length 262144 bytes
09:58:41.287264 eth0  B   ARP, Request who-has 10.0.0.178 tell 10.0.0.1, length 46
09:58:42.351755 eth0  B   ARP, Request who-has 10.0.0.178 tell 10.0.0.1, length 46
09:58:43.391696 eth0  B   ARP, Request who-has 10.0.0.178 tell 10.0.0.1, length 46
09:58:44.432961 eth0  B   ARP, Request who-has 10.0.0.178 tell 10.0.0.1, length 46
```

**Comment by seagate00** [comment]
Please note: if this situation occurs, terminating the `com.android.networkstack.process` process helps; it automatically restarts and the network works normally again. LineageOS bug?

**Comment by Vmex26** [comment]
I'm hitting what looks like the exact same issue on a different distro/kernel . Adding my details in case it helps narrow down the cause.

**Environment**
- Distro: CachyOS (Arch-based)
- Kernel: `7.0.12-1-cachyos`
- Waydroid: `1.6.3-1` (installed from official Arch `extra` repo, not AUR)
- Vendor type: `MAINLINE`
- Display: Wayland (KDE plasma 6)

**Symptom**
- `waydroid0` bridge on host is healthy: `192.168.240.1/24`, UP
- `dnsmasq` is running and bound to `waydroid0`, and **does** hand out a real DHCP lease (confirmed via `/var/lib/misc/dnsmasq.waydroid0.leases`, matching MAC of `eth0` inside the container)
- Despite a valid lease existing, inside Waydroid:
  - `ip addr show eth0` only shows an IPv6 link-local address (`fe80::...`), no IPv4
  - `ip route show` is completely empty
  - `ping 8.8.8.8` → `Network is unreachable`
- `waydroid status` reports `IP address: 192.168.240.112` (matching the dnsmasq lease), but this doesn't seem to reflect the real live interface state, since `ip a` inside the container shows no IPv4 on eth0 at the same time

**Relevant logcat output**

```
E DhcpClient: Error retrieving network attributes: ILLEGAL ARGUMENT
E Netd    : Removing unknown address fe80::<redacted>/64 from ifindex 2
```

Followed by repeated:
```
W DeviceStateUtils: Active network is null
```

This suggests `DhcpClient`/`IpClient` receives the lease but fails during processing, and `ConnectivityService` never marks the `eth0` network as active, so no routes ever get installed — even though the IP was successfully handed out at the DHCP layer.

**What I've ruled out (all reproduced with no change in behavior):**
- Host firewall (UFW with custom `nft`/`iptables` rules) — tested with `ufw` fully active and also after `nft flush ruleset` + clean container restart
- NAT/MASQUERADE — confirmed present and correctly targeting the right uplink interface
- IPv6 disabled at kernel level — confirmed `net.ipv6.conf.all.disable_ipv6 = 0` (enabled)
- `LXC_USE_NFT` in `waydroid-net.sh` — tested both `"true"` and `"false"`, no difference
- Full purge and reinit (`rm -rf /var/lib/waydroid`, fresh `waydroid init`) — same exact symptom on a brand new install
- Restarting `netd` inside the container (`killall netd`) — no change
- Toggling `eth0` down/up inside the container — no change

**Possible kernel correlation**

I noticed issue #2318 on this repo also reports kernel `7.0.0-15-generic` — also in the 7.0.x series. My kernel is `7.0.12-1-cachyos`. Wondering if this is pointing to a regression specific to the 7.0 kernel series interacting with LXC network namespaces or Android's `DhcpClient`/`netd`.

**Comment by ViviNoSmol** [comment]
I'm seeing the exact same issue on Fedora-based Nobara 44, kernel 7.1.4-200.nobara.fc44.x86_64.

Symptoms match: IPv4 works fine for a while, then starts showing intermittent packet loss / 
"Network is unreachable" errors. IPv6 wasn't tested specifically but the container has a valid 
IPv4 lease from dnsmasq (confirmed via `waydroid status` and `ip addr` inside the guest) the 
issue isn't DHCP failing, it's connectivity after the lease is already active.

Ruled out on my end: CPU governor, PCIe ASPM policy, conntrack table limits, tuned profiles, 
Cloudflare WARP client interference, kernel-level IPv6 disable (issue #1863 not applicable, 
ipv6.disable isn't set on my cmdline).

tcpdump on both waydroid0 (host bridge) and the real uplink interface simultaneously shows 
ICMP requests leaving the guest and NAT/MASQUERADE working correctly when the connection is 
healthy, but packets get lost somewhere between the guest's netd and the bridge during the 
failure windows. no drops/errors counted on the host bridge interface itself during loss.

Workaround that reliably restores connectivity for a bit: full `waydroid session stop` + 
`systemctl restart waydroid-container.service` + `waydroid session start`. A plain 
`waydroid shell -- reboot` does NOT work
I say for a bit because after a few seconds, the same bug happens again. Timeouts and packet losses.

Happy to share logs/tcpdump captures if useful.
